{"$schema":"https://json-schema.org/draft/2020-12/schema","title":"QSOL-INT Parent Contract Snapshot","type":"object","required":["type","protocol","version","snapshot_date","parents","freshness"],"properties":{"type":{"const":"qsol-int-parent-contracts"},"protocol":{"const":"QSOL-INT"},"version":{"type":"string"},"snapshot_date":{"type":"string"},"parents":{"type":"object","required":["substrate","ark"]},"freshness":{"type":"object"}}}
